{"bootstrapPolicy":"provision-untracked","commands":{"apply":{"args":["apply","--contract","embedded","--expect-contract-fingerprint","<contract-fingerprint>","--plan","<plan-file>","--expect-plan-digest","<plan-digest>","--exclusive","--bootstrap-policy","provision-untracked"],"executable":"/usr/local/bin/mnemoshare-migrate"},"plan":{"args":["plan","--contract","embedded","--expect-contract-fingerprint","<contract-fingerprint>","--output","<plan-file>","--result","<result-file>"],"executable":"/usr/local/bin/mnemoshare-migrate"},"verify":{"args":["verify","--contract","embedded","--expect-contract-fingerprint","<contract-fingerprint>","--plan","<plan-file>","--expect-plan-digest","<plan-digest>"],"executable":"/usr/local/bin/mnemoshare-migrate"}},"executable":"/usr/local/bin/mnemoshare-migrate","fingerprint":"b6ee7213b661ee246d6446b691a28f0503fb85bc452340ebccb9d9f6308fa404","governedProcesses":[{"executableId":"api","profileId":"default","universes":["primary"]},{"executableId":"background-worker","profileId":"default","universes":["primary"]},{"executableId":"cloud-worker","profileId":"default","universes":["primary"]},{"executableId":"emailgateway","profileId":"relay-dkim","universes":["email-relay-mongo"]},{"executableId":"emailgateway","profileId":"relay-dkim-and-tokens","universes":["email-relay-mongo"]},{"executableId":"inboundgateway","profileId":"default","universes":["primary"]},{"executableId":"migrate-dek-rewrap","profileId":"default","universes":["primary"]},{"executableId":"migrate-dek-rewrap-context","profileId":"default","universes":["primary"]},{"executableId":"repair-audit-chain","profileId":"default","universes":["primary"]},{"executableId":"workflow-worker","profileId":"default","universes":["primary"]}],"lifecycle":{"failureAfterCommitted":"remain-down-forward-repair-no-rollback","order":["plan-all","down","apply-verify-all","up"]},"planning":{"allowedModes":["ordinary","legacy-bootstrap"],"defaultMode":"ordinary","modeFlag":"--planning-mode","omitDefault":true},"provenance":{"generator":"tools/migrationoperationcontract","schema":"mnemoshare.migration-operation.v2","sourceFingerprint":"1281ad540022103ae747a32a14fb80d7f1b12db53209fdad26f66a3bb14be5d2"},"result":{"digestEncoding":"sha256-hex-lowercase","mediaType":"application/json","planDigestField":"planDigest","resultFlag":"--result","schema":"mnemoshare.migration-result.v1"},"schemaOwnership":"exclusive-operation","universeFlag":"--universe","universes":[{"carrier":"application-database","formats":[{"current":"11-58091c-fa97218c","legacy":"11-58091c-fa97218c","populationId":"000000","populationName":"legacy","projection":"mongodb-bson","retained":[{"id":"11-58091c-fa97218c","revision":4204208524,"source":"internal/capabilities/antivirus/icap_config.go:61"}],"surface":"antivirus.icap_config"},{"current":"11-1610ab-134aa08f","legacy":"11-1610ab-134aa08f","populationId":"000000","populationName":"legacy","projection":"mongodb-bson","retained":[{"id":"11-1610ab-134aa08f","revision":323657871,"source":"internal/domains/as2/as2_message_repo.go:16"}],"surface":"as2.as2_messages"},{"current":"11-c39555-04c2da5a","legacy":"11-c39555-04c2da5a","populationId":"000000","populationName":"legacy","projection":"mongodb-bson","retained":[{"id":"11-c39555-04c2da5a","revision":79878746,"source":"internal/domains/as2/trading_partner_repo.go:17"}],"surface":"as2.trading_partners"},{"current":"11-a7141f-c50e33bc","legacy":"11-a7141f-c50e33bc","populationId":"000000","populationName":"legacy","projection":"mongodb-bson","retained":[{"id":"11-a7141f-c50e33bc","revision":3306042300,"source":"internal/capabilities/audit/activity_counter.go:51"}],"surface":"audit.activity_counters"},{"current":"11-e03322-698dc127","legacy":"11-e03322-698dc127","populationId":"000000","populationName":"legacy","projection":"mongodb-bson","retained":[{"id":"11-e03322-698dc127","revision":1770897703,"source":"internal/capabilities/audit/audit_chain_state_spec.go:45"}],"surface":"audit.audit_chain_heal_lock"},{"current":"11-622d2f-9e4841f0","legacy":"11-622d2f-9e4841f0","populationId":"000000","populationName":"legacy","projection":"mongodb-bson","retained":[{"id":"11-622d2f-9e4841f0","revision":2655535600,"source":"internal/capabilities/audit/audit_chain_state_spec.go:14"}],"surface":"audit.audit_chain_state"},{"current":"11-693620-d4069631","legacy":"11-693620-65016b5b","populationId":"000000","populationName":"legacy","projection":"mongodb-bson","retained":[{"id":"11-693620-65016b5b","revision":1694591835,"source":"internal/capabilities/audit/audit_log_spec.go:16"},{"id":"11-693620-d4069631","revision":3557201457,"source":"internal/capabilities/audit/audit_log_spec.go:16"}],"surface":"audit.audit_logs","transitions":[{"from":"11-693620-65016b5b","to":"11-693620-d4069631"}]},{"current":"11-8a53f9-8070920b","legacy":"11-8a53f9-8070920b","populationId":"000000","populationName":"legacy","projection":"mongodb-bson","retained":[{"id":"11-8a53f9-8070920b","revision":2154861067,"source":"internal/domains/backup/backup_job.go:43"}],"surface":"backup.backup_jobs"},{"current":"11-acb8f5-b0fca816","legacy":"11-acb8f5-b0fca816","populationId":"000000","populationName":"legacy","projection":"mongodb-bson","retained":[{"id":"11-acb8f5-b0fca816","revision":2969348118,"source":"internal/domains/backup/backup_schedule_lock.go:52"}],"surface":"backup.backup_schedule_locks"},{"current":"11-5e4d32-06dc75e8","legacy":"11-5e4d32-06dc75e8","populationId":"000000","populationName":"legacy","projection":"mongodb-bson","retained":[{"id":"11-5e4d32-06dc75e8","revision":115111400,"source":"internal/domains/backup/backup_schedule.go:88"}],"surface":"backup.backup_schedules"},{"current":"11-56842d-ed64bd5c","legacy":"11-56842d-ed64bd5c","populationId":"000000","populationName":"legacy","projection":"mongodb-bson","retained":[{"id":"11-56842d-ed64bd5c","revision":3982802268,"source":"internal/domains/cert/kind/certificatesaga/sqlstore/spec.go:30"}],"surface":"cert.kind.certificatesaga.sqlstore.certificate_sagas"},{"current":"11-cd1bf6-08b61bcc","legacy":"11-cd1bf6-08b61bcc","populationId":"000000","populationName":"legacy","projection":"mongodb-bson","retained":[{"id":"11-cd1bf6-08b61bcc","revision":146152396,"source":"internal/domains/cloud/enrollment_sync_run.go:55"}],"surface":"cloud.cloud_enrollment_sync_runs"},{"current":"11-66756c-7c4dce17","legacy":"11-66756c-7c4dce17","populationId":"000000","populationName":"legacy","projection":"mongodb-bson","retained":[{"id":"11-66756c-7c4dce17","revision":2085473815,"source":"internal/domains/cloud/cloud_integration.go:37"}],"surface":"cloud.cloud_integrations"},{"current":"11-a22e07-d8963e7c","legacy":"11-a22e07-d8963e7c","populationId":"000000","populationName":"legacy","projection":"mongodb-bson","retained":[{"id":"11-a22e07-d8963e7c","revision":3633725052,"source":"internal/domains/cloud/cloud_scan_result.go:40"}],"surface":"cloud.cloud_scan_results"},{"current":"11-f2b473-3a278a08","legacy":"11-f2b473-3a278a08","populationId":"000000","populationName":"legacy","projection":"mongodb-bson","retained":[{"id":"11-f2b473-3a278a08","revision":975669768,"source":"internal/domains/cloud/kind/backfillsaga/sqlstore/spec.go:29"}],"surface":"cloud.kind.backfillsaga.sqlstore.backfill_sagas"},{"current":"11-be60b3-6d19a4a6","legacy":"11-be60b3-6d19a4a6","populationId":"000000","populationName":"legacy","projection":"mongodb-bson","retained":[{"id":"11-be60b3-6d19a4a6","revision":1830397094,"source":"internal/domains/cloud/kind/subscriptionsaga/sqlstore/spec.go:28"}],"surface":"cloud.kind.subscriptionsaga.sqlstore.subscription_sagas"},{"current":"11-b171c5-33e91aa6","legacy":"11-b171c5-33e91aa6","populationId":"000000","populationName":"legacy","projection":"mongodb-bson","retained":[{"id":"11-b171c5-33e91aa6","revision":870914726,"source":"internal/domains/cloud/mail_backfill_coverage_input.go:32"}],"surface":"cloud.mail_backfill_coverage_inputs"},{"current":"11-7b3321-0f2b66e8","legacy":"11-7b3321-0f2b66e8","populationId":"000000","populationName":"legacy","projection":"mongodb-bson","retained":[{"id":"11-7b3321-0f2b66e8","revision":254502632,"source":"internal/domains/cloud/mail_backfill.go:121"}],"surface":"cloud.mail_backfill_passes"},{"current":"11-7bab69-44e8df45","legacy":"11-7bab69-44e8df45","populationId":"000000","populationName":"legacy","projection":"mongodb-bson","retained":[{"id":"11-7bab69-44e8df45","revision":1156112197,"source":"internal/domains/cloud/mail_backfill.go:134"}],"surface":"cloud.mail_backfill_progress"},{"current":"11-d9c50f-33f11638","legacy":"11-d9c50f-33f11638","populationId":"000000","populationName":"legacy","projection":"mongodb-bson","retained":[{"id":"11-d9c50f-33f11638","revision":871437880,"source":"internal/domains/cloud/mail_backfill_receipt.go:60"}],"surface":"cloud.mail_backfill_receipts"},{"current":"11-69fbde-568448ea","legacy":"11-69fbde-568448ea","populationId":"000000","populationName":"legacy","projection":"mongodb-bson","retained":[{"id":"11-69fbde-568448ea","revision":1451509994,"source":"internal/domains/cloud/mail_poll.go:73"}],"surface":"cloud.mail_poll_cycles"},{"current":"11-6959d9-977404f1","legacy":"11-6959d9-977404f1","populationId":"000000","populationName":"legacy","projection":"mongodb-bson","retained":[{"id":"11-6959d9-977404f1","revision":2540963057,"source":"internal/domains/cloud/mail_poll.go:75"}],"surface":"cloud.mail_poll_mailbox_results"},{"current":"11-c1c2c6-04b70162","legacy":"11-c1c2c6-04b70162","populationId":"000000","populationName":"legacy","projection":"mongodb-bson","retained":[{"id":"11-c1c2c6-04b70162","revision":79102306,"source":"internal/domains/cloud/mail_poll.go:77"}],"surface":"cloud.mail_poll_message_receipts"},{"current":"11-1cfb91-6c5f2e2d","legacy":"11-1cfb91-6c5f2e2d","populationId":"000000","populationName":"legacy","projection":"mongodb-bson","retained":[{"id":"11-1cfb91-6c5f2e2d","revision":1818177069,"source":"internal/domains/cloud/mailbox_registry.go:116"}],"surface":"cloud